{
  "$schema": "https://json-schema.org/draft/2020-12/schema",
  "title": "Narration Timeline",
  "type": "object",
  "required": [
    "version",
    "duration",
    "segments"
  ],
  "properties": {
    "version": {
      "type": "string"
    },
    "source": {
      "type": "string"
    },
    "audio_file": {
      "type": [
        "string",
        "null"
      ]
    },
    "duration": {
      "type": "number",
      "minimum": 0
    },
    "segments": {
      "type": "array",
      "items": {
        "type": "object",
        "required": [
          "id",
          "text",
          "start",
          "end"
        ],
        "properties": {
          "id": {
            "type": "string"
          },
          "text": {
            "type": "string"
          },
          "start": {
            "type": "number",
            "minimum": 0
          },
          "end": {
            "type": "number",
            "minimum": 0
          },
          "emotion": {
            "type": "string"
          },
          "words": {
            "type": "array",
            "items": {
              "type": "object",
              "required": [
                "word",
                "start",
                "end"
              ],
              "properties": {
                "word": {
                  "type": "string"
                },
                "start": {
                  "type": "number",
                  "minimum": 0
                },
                "end": {
                  "type": "number",
                  "minimum": 0
                },
                "confidence": {
                  "type": [
                    "number",
                    "null"
                  ]
                }
              },
              "additionalProperties": false
            }
          }
        },
        "additionalProperties": false
      }
    },
    "transcription": {
      "type": "object",
      "additionalProperties": true
    }
  },
  "additionalProperties": false
}
